11:05:15.549505 Out ethertype IPv4 (0x0800), length 184: 164.132.241.118.ssh > 46.153.24.8.64470: Flags [P.], seq 1545550548:1545550676, ack 3858082575, win 656, length 128
11:05:15.549538 Out ethertype IPv4 (0x0800), length 200: 164.132.241.118.ssh > 46.153.24.8.64470: Flags [P.], seq 128:272, ack 1, win 656, length 144
11:05:15.575954  In ethertype IPv4 (0x0800), length 48: 139.99.1.148 > 178.32.115.96: ICMP echo request, id 39231, seq 1, length 12
11:05:15.626228  In ethertype IPv4 (0x0800), length 56: 46.153.24.8.64470 > 164.132.241.118.ssh: Flags [.], ack 0, win 1023, length 0
11:05:15.636383  In ethertype IPv4 (0x0800), length 56: 46.153.24.8.64470 > 164.132.241.118.ssh: Flags [.], ack 272, win 1028, length 0
11:05:17.822440  In ethertype IPv4 (0x0800), length 48: 92.222.186.1 > 178.32.115.96: ICMP echo request, id 39667, seq 1, length 12
11:05:17.919941  In ethertype IPv4 (0x0800), length 76: 45.132.227.47.7971 > 178.32.115.96.https: Flags [S], seq 2852913821, win 64240, options [mss 1460,sackOK,TS val 2312119749 ecr 0,nop,wscale 8], length 0
11:05:17.920676  In ethertype IPv4 (0x0800), length 76: 45.132.227.47.https-wmap > 178.32.115.96.https: Flags [S], seq 2632124634, win 64240, options [mss 1460,sackOK,TS val 2312119749 ecr 0,nop,wscale 8], length 0
11:05:17.920700  In ethertype IPv4 (0x0800), length 76: 45.132.227.47.25261 > 178.32.115.96.https: Flags [S], seq 3103305364, win 64240, options [mss 1460,sackOK,TS val 2312119749 ecr 0,nop,wscale 8], length 0
11:05:17.920716  In ethertype IPv4 (0x0800), length 76: 45.132.227.47.9147 > 178.32.115.96.https: Flags [S], seq 3139437790, win 64240, options [mss 1460,sackOK,TS val 2312119749 ecr 0,nop,wscale 8], length 0
11:05:17.920746  In ethertype IPv4 (0x0800), length 76: 45.132.227.47.24649 > 178.32.115.96.https: Flags [S], seq 3188180793, win 64240, options [mss 1460,sackOK,TS val 2312119749 ecr 0,nop,wscale 8], length 0
11:05:17.922822  In ethertype IPv4 (0x0800), length 76: 45.132.227.47.17709 > 178.32.115.96.https: Flags [S], seq 452323311, win 64240, options [mss 1460,sackOK,TS val 2312119749 ecr 0,nop,wscale 8], length 0
11:05:17.924803  In ethertype IPv4 (0x0800), length 76: 45.132.227.47.29887 > 178.32.115.96.https: Flags [S], seq 346275818, win 64240, options [mss 1460,sackOK,TS val 2312119749 ecr 0,nop,wscale 8], length 0
11:05:18.074874  In ethertype IPv4 (0x0800), length 48: 92.222.186.1 > 164.132.241.118: ICMP echo request, id 39667, seq 1, length 12
11:05:19.653512  In ethertype IPv4 (0x0800), length 48: 167.114.37.1 > 178.32.115.96: ICMP echo request, id 12257, seq 1, length 12
11:05:19.744981  In ethertype IPv4 (0x0800), length 48: 92.222.184.1 > 178.32.115.96: ICMP echo request, id 39748, seq 1, length 12
11:05:20.492832  In ethertype IPv4 (0x0800), length 48: 139.99.1.148 > 164.132.241.118: ICMP echo request, id 39231, seq 1, length 12
11:05:20.737411  In ethertype IPv4 (0x0800), length 76: 45.132.227.47.29399 > 178.32.115.96.https: Flags [S], seq 650892534, win 64240, options [mss 1460,sackOK,TS val 2312122565 ecr 0,nop,wscale 8], length 0
11:05:20.973882  In ethertype IPv4 (0x0800), length 48: 92.222.184.1 > 164.132.241.118: ICMP echo request, id 39748, seq 1, length 12
11:05:24.014677  In ethertype IPv4 (0x0800), length 56: 103.178.236.40.54500 > 164.132.241.118.garcon: Flags [S], seq 4088312518, win 65535, length 0
